id,createdAt,hs_object_id,name,description
f19a8708-b0ef-4077-af64-ffbacfc5ddee,2025-05-22 17:50:26,989711,Travel,Direction what child member college.
97d9cde0-37e2-46a1-9f86-01d3ac38e338,2025-04-06 12:02:32,884028,Mind,Small east manager information yourself wife program.
0ff77f31-5ae9-460a-adc8-3f3393209aaf,2025-07-26 19:22:37,801788,Phone,Something five guy feeling.
f01a5fa1-45b8-425b-b727-7faba8b1b19a,2025-03-13 17:53:20,592393,Can,Music deal report meeting control.
ea07e00d-4c95-40e6-a60d-f95b56fcb47b,2025-02-16 01:47:46,686005,Main,Tend financial kid summer clearly.
28a6f7e5-f3c7-43e4-9b75-8064c3da32cd,2025-03-06 09:09:16,919243,Cost,North want stage.
9dd90105-c666-46d0-b3c6-f2d4aa0d8f03,2025-07-23 23:38:59,872641,Arrive,Recent between common.
899639c8-4ac8-4270-93d3-578c90dbeb09,2025-04-14 10:54:05,499962,Room,While from ago with admit many gas major.
65c33a7e-d98b-455d-a0e6-82b6ca2eb67c,2025-06-10 03:24:00,804412,Fear,Operation no on find also.
a5b90079-e3d1-414f-82b5-39217b365928,2025-02-16 19:21:19,415739,Collection,Box institution test contain.
59a305dc-8506-4cf3-b296-3340a4426361,2025-01-02 02:36:33,475469,Prepare,Beyond success audience other move far newspaper.
8e2cbe95-59c3-424b-9557-bb435c118cae,2025-06-01 12:47:42,618442,Control,Present begin order.
8f404840-1e43-4401-8f32-418c9f026c9e,2025-07-27 23:01:43,781671,Mother,Question those until indeed live loss question long.
759daff4-975b-4602-889a-90bcfbfc679f,2025-06-11 10:12:34,942648,Thank,Sister fish hear ground we computer glass.
9428d729-c612-487c-bb24-b1ff557f812c,2025-06-03 15:12:01,523726,Recently,Whether camera energy.
3c511af4-c87c-4a81-8948-062a8760f52d,2025-01-31 19:29:31,983011,Daughter,Laugh exist run election treatment.
7f06aaa1-de6d-46eb-a69f-828b115b2e29,2025-07-13 04:51:28,362066,News,Surface tell college hotel machine apply.
241c5c7f-12d5-4853-8785-d129f933d518,2025-05-03 20:41:17,338379,Employee,Community even else computer before.
908db377-77e6-4b6b-9ca4-0b0cc9934c14,2025-03-24 05:49:33,512718,Everyone,Science early house include future.
3cf0e36d-c028-47a9-a252-0d794f6646ec,2025-05-18 00:15:06,163851,Put,Window several method sort factor early.
6a489e52-cb24-40f5-b8fc-f40ee02e5e50,2025-07-19 19:08:16,584970,Pressure,Letter American family adult protect end well ago.
cf41ed8b-351b-441a-9e20-054832c757e8,2025-03-01 19:54:39,908685,Rise,Bar politics woman central general.
ef5ab686-4a51-437b-b934-7ab9984feac1,2025-06-23 04:56:46,952397,Professor,Garden exactly move on some successful pass hotel.
89115a90-66f3-4e37-9e58-bbd3ed66bf67,2025-06-19 23:08:36,849366,Human,East perhaps behavior people environmental claim.
17fe4b57-9e86-4257-abc3-b49a47304a3a,2025-06-05 05:45:08,417494,Dream,Wide to six hour that particular heavy return.
a76cf057-3137-4bc1-8524-767aedbeb97e,2025-02-17 12:04:33,829593,Together,Although onto health tell figure.
59397ebc-fa76-44e1-9d7d-64a65e4eb76a,2025-01-18 19:07:06,975726,Chair,Agree until speech data film start.
e64af1ba-2714-4a99-8a4d-8d303c717833,2025-04-11 18:53:54,144488,Including,Off less modern plan property family.
d8a0559f-fef1-49ef-a660-630e354859e0,2025-06-26 23:01:09,394662,Seven,Interest us church often water manager sister civil.
a470a2cf-7954-47f1-afdf-552b2b9acb88,2025-01-04 19:55:59,929861,Establish,Though head reduce key answer.
4c8eaa85-0bf6-4b9e-959d-bb376bf10546,2025-07-13 22:08:49,186595,Admit,Also investment day.
e70d85cc-3f31-4473-913a-6239b3314b82,2025-07-17 21:32:33,928262,Inside,Mother them choose sense different.
350a07df-41a5-4a19-831e-0e9499280c1d,2025-07-10 12:32:33,282163,Statement,Apply almost reality collection daughter shake lawyer.
964fb3b2-24a4-481d-b5a0-e0797b0f627e,2025-03-22 12:35:57,647257,Next,Name him many future ahead.
43f23681-9e85-41a7-b46c-495a56e6e52d,2025-01-07 09:50:22,758407,You,Evening administration recent cost read exactly.
ad96e8ab-56e2-4f30-90da-c92afcfeca47,2025-01-29 10:35:52,707058,Factor,Travel money response establish drop writer story.
e85230b1-c97d-41a1-9e63-7886b5066b5c,2025-04-30 11:54:15,562618,Fire,Exist act no room police.
c9dc04cf-63ff-4a84-af4c-09c072f466ea,2025-07-29 21:10:54,377925,Notice,Seek war need.
95cc3da3-888f-43c7-8546-740ac56dae8b,2025-02-23 22:48:13,299446,Night,Coach account hundred street.
58d9f9d4-54b1-41fb-a654-e3271d3f669c,2025-01-09 05:34:49,156697,Clearly,Card huge never place in number sing.
94e66428-ef14-4534-b663-207ee4fc534d,2025-05-29 14:40:02,375964,Image,Whatever friend never.
073486b8-2e20-48f0-a966-6370d991f960,2025-04-26 20:02:40,691954,Huge,Project race cold financial there wait up.
be5ce327-6f3e-4b90-b790-eba5ac92c551,2025-07-29 05:28:52,558823,Result,Lawyer condition produce generation account.
30f7d1ec-5b01-472b-b24f-be87405403ee,2025-06-13 17:23:44,962034,Phone,Walk partner lose.
2e2e2a1b-ae2c-4c19-97e8-4ef5f390e29a,2025-01-22 12:16:11,854087,Pick,With figure ok describe almost the small why.
5c34a87e-c98b-45d5-a619-55ab27ec1050,2025-07-05 18:11:47,428483,Health,According difference detail clearly sing.
a02328c8-522f-4fe2-ae16-25940686efd2,2025-06-22 12:57:21,419771,Issue,Consider risk thought language wrong subject research.
39c15051-f383-4c40-b738-69dd8bbe9d13,2025-06-29 21:39:33,779485,Evening,Return couple professor no near campaign once.
0276820f-cc2c-4cea-b7a1-d215d90340f0,2025-01-22 10:43:16,731587,Country,Wife book listen.
f1246f97-026b-4caf-b926-9807c3422749,2025-07-02 03:36:49,578059,Similar,Less health start difficult art.
3d2d2502-c451-4e48-9e24-5f268e7f5fcb,2025-02-01 04:34:36,960381,Size,Head state turn especially still family decision.
db8557d0-20cd-4791-bad5-ce9a065fb12e,2025-01-30 06:55:54,777303,Ability,Image fact table nor speak.
6cfa9b61-129f-4c96-a99d-85f2cfb1b8fa,2025-03-17 20:19:06,745135,Course,Store change pass turn hospital skin level.
abd63f87-d851-4e26-a5d4-3ab11f38e9ff,2025-07-12 21:41:28,752602,Ten,Film difference trial candidate decade and already.
ecfa8cb1-611f-4034-ae1f-501c50b44e4e,2025-06-01 10:49:42,620743,Cause,Course agreement nearly economy under.
8d343312-38b5-48b8-bc16-26e6f84d38c0,2025-06-22 07:08:30,143729,Majority,Front family pick new hear.
2c1b4c67-e93e-4a4a-a72c-fe44415e48ac,2025-04-03 15:38:02,347580,Option,Allow light TV item market.
af183589-707b-4289-8a1e-b76d0de17790,2025-04-28 02:42:39,865709,Five,Available really way manager store amount nearly.
2373f84b-c457-4a4f-acea-05983e955352,2025-01-13 10:57:27,621634,Take,Two face them his.
5c496f84-1ad6-4519-bdff-cb67ba68283b,2025-01-19 22:05:07,324291,Perhaps,Where service chair expert worry age.
03413fa5-3e43-4060-9886-52a24b1b2142,2025-04-20 00:51:03,696337,Or,Over entire spend.
7befb543-4e96-49cb-bfe4-d16af5455f4d,2025-03-01 03:29:23,710928,Each,Student charge pick build will these.
be8c2a2b-04e9-4eb5-abe3-c8f56cf1cf3b,2025-04-06 08:24:39,312335,Size,Everything state morning door interesting.
2cd2cffc-50b3-4684-bb07-cbef9c3c6c20,2025-06-23 18:58:52,695899,Doctor,Special need he force.
f1babc52-7c0f-485a-9f3c-9f746cff94ad,2025-08-05 19:06:23,472453,Paper,Chair to threat part.
e03d4adb-4571-47c5-9d49-fb4bc91c722f,2025-01-23 03:45:05,427393,Coach,Yourself reach her fall now form something.
fdb75121-2d47-4be8-a32e-54a860c157a5,2025-01-19 13:53:16,201133,Firm,Man pretty suffer wrong resource.
15015cc9-4d7a-4def-9cb8-b266afe3fcd5,2025-03-31 19:46:42,456648,Possible,Bill deal reach difference.
e3d7a7c8-6995-4458-ab43-384921c448a7,2025-03-15 12:29:24,640634,Use,Father focus challenge head.
818185cb-c317-4354-b9ee-363ea41b9b9e,2025-03-08 06:53:21,769303,Pretty,Party size reality bring seat again however send.
58eedf60-7c4d-4ddc-94ca-ff6c14615039,2025-07-12 09:09:13,608495,Crime,Far one right day star value late.
4db04bb1-7d55-473b-991e-613b9bf19e9c,2025-01-28 14:45:57,982825,My,Of big oil the scene song.
e820f323-842e-46a2-ab77-5f465f7c5163,2025-05-18 11:48:52,744704,Some,Bill smile myself assume major over.
b7f68f0b-cda0-4165-9607-cb1c58006c64,2025-04-02 12:34:29,108804,Draw,Organization difficult thing from social.
a67becff-89db-48b3-86e0-357de965f836,2025-06-21 11:03:44,791293,Before,Fine organization which final.
cb8e30f7-6e86-41d9-addf-fca52536befc,2025-06-07 19:08:04,447885,Place,Do over remain environmental.
280461e6-a86f-4185-b664-30e5ad21eb82,2025-08-09 04:59:07,217305,Meet,Worker section red throw hotel.
e34c766c-afc9-4889-b8c9-16e22c9ff806,2025-06-09 13:08:57,880748,Outside,Too budget than each artist beat.
e5e24352-f79b-4af2-8815-f99e953c3625,2025-06-28 14:44:13,177117,Baby,Single fund we approach seven.
18082f4f-a2f3-4cc5-aaf6-7846a0073810,2025-07-06 09:00:48,872784,Message,Condition floor daughter perform.
d802df80-819c-4776-b0b6-cd7ed88c9430,2025-06-19 21:57:49,489657,Along,Take voice society my home else.
ab1bd95f-daa1-42d2-83e5-5ff3e062f546,2025-04-09 04:41:13,846232,Hair,Help the strong agreement whatever.
08950c94-daa3-4987-b9a9-a6d144e42c71,2025-05-24 22:39:56,809122,Determine,Onto structure board which phone.
74f50d09-588c-49d4-b225-9bdaf2700867,2025-03-05 04:29:30,800285,Administration,Weight when order rest build work anything.
8d67f82f-daab-47af-87c0-67bcbda59ab2,2025-01-13 10:50:00,810363,Gas,Friend offer even near whole increase beyond.
f45aef87-54aa-43ae-a9b4-d725b475bbf7,2025-05-07 01:51:04,643133,Trouble,Travel smile board upon what.
ba4308ed-38f2-4adb-94f2-2fb37dfd83cd,2025-05-25 05:18:00,964826,Join,Number table natural.
54b478fa-763b-414c-9c1d-7c7455cba14e,2025-01-15 04:41:09,107985,Back,Tend beat get up.
5209e848-4933-4f75-92c9-ba95d82aa1a1,2025-06-30 16:34:06,929724,About,Finally economic store team instead left able party.
310d3b4e-3358-42f7-a6f0-03c433489653,2025-07-11 03:40:55,531218,Why,Seven agency section science sound.
0f206693-9016-4fcd-b55a-df8a18bf9968,2025-02-06 05:09:14,639145,Join,Character blood husband coach.
93960b1f-0864-4a77-b3db-0b1b42bb92a2,2025-04-24 16:15:59,241596,Debate,Note majority else instead once author cold true.
a72303df-5e33-4346-80ac-d72534107a61,2025-05-10 00:59:12,566970,Important,Big fast majority degree serve organization whether.
1799b299-eee5-40f9-9a84-daf81b0b0e23,2025-06-21 01:15:21,931867,Generation,Usually surface commercial appear anyone should.
204b26e4-4e3e-47f8-b5be-ba5d0c8ec8c9,2025-02-25 09:34:43,637914,Way,Page investment individual bill.
70e03256-321f-4c21-9a26-3b0ea2485295,2025-03-17 07:00:32,602652,Do,Program black despite among successful.
d304fb2b-ad74-489a-a13f-bae2e4a9f3d9,2025-06-25 10:09:54,495857,State,Kind social old decide water tax get.
08c823b4-f2eb-4e3b-9717-698653a5bf91,2025-04-04 14:18:43,453693,Month,Course maybe score modern bank that.
5ea873f1-6a30-4271-9e22-31181d6d1388,2025-06-13 07:41:02,198381,Since,Family school take onto many.
144f45c0-1834-4a77-a0be-0b8b178e2da8,2025-04-18 18:02:47,588726,Expert,Class rock score long.
