id,createdAt,hs_object_id,name,description
9ffd374b-0892-4835-a1d0-24eab1e4202f,2025-01-17 05:58:03,437301,Value,Surface serve animal some.
582ee143-0719-4b43-ba2b-ede89b5bb5fd,2025-06-13 17:21:13,957357,Exist,Land common prepare fast cup baby.
31828d92-0b82-4789-9fda-6366f6d3de4d,2025-01-09 01:09:17,177347,Subject,Young successful across condition when series talk.
32fa5f73-a404-4cff-b906-d9a18257817d,2025-01-05 13:31:59,733037,Program,Cold ever financial million claim.
126ff395-4690-4010-86d2-786525f5e946,2025-04-25 19:35:45,752744,Purpose,Himself fast something.
9789d544-3543-42f1-9339-c8681382946b,2025-04-21 10:35:55,575618,Reality,Maintain matter foreign girl authority cut can.
f88974b3-d255-4bc5-9a61-b5824c4de160,2025-07-01 21:54:02,587881,Field,Far daughter local economy who according just.
65d3937e-3fdc-4f8a-9a57-8d627f9be426,2025-08-07 17:45:40,559464,Laugh,Whom community professor.
5ff1eb67-5f9e-432c-a891-476393e27aff,2025-03-21 01:28:19,420577,Hope,Give wall shoulder data after worry.
3517a92d-2e16-4a29-856a-93e744cceafa,2025-06-07 04:57:13,373234,Buy,Administration between role word clear treatment.
8ea66250-7781-4a0f-95c8-c1ef667f0c5e,2025-02-26 18:51:06,966299,Role,Dark address night executive feel cause land.
cd8c0539-f9c5-49b6-81e9-3b9a7d347f5a,2025-07-24 08:40:47,524764,Management,Now health look century idea move run lose.
1108cc98-9b63-4716-a31d-88d650bb1b70,2025-03-14 04:18:59,143996,Quickly,Western last instead.
48fe2dd3-6b23-44fe-870c-4a46f7ef5ec7,2025-01-15 18:01:36,247564,Quite,Member drug there toward.
1dfe6fc8-a0d3-4138-b782-67bb91a40742,2025-05-19 09:05:14,942401,Doctor,Age wind perhaps agency within.
d1acb12e-9b4c-4003-9d18-a9b2f324e576,2025-01-13 07:20:22,889747,Land,Those professor spring.
1babccc7-9b9e-40c6-8573-8e7ec6763246,2025-02-21 05:26:15,301126,Be,Tree fire system arm management include senior.
069245e8-e307-4df2-8802-a4d9ddafa582,2025-07-14 03:24:34,799749,Then,No break wish sea account special stay.
57cbe734-884a-485c-8dac-eeec75983bb3,2025-07-18 14:23:01,421567,Measure,My important debate walk wind indeed.
ed6d7f04-6511-407f-90f2-b96f45bad60a,2025-02-17 20:37:59,485010,Alone,Party western some article idea difference.
baeca639-4e8d-4e2a-b90b-3a08faf43c97,2025-04-19 20:18:45,822314,Will,Occur decision including challenge card.
67d9753b-d01e-4522-b4bf-c37103664f41,2025-07-19 00:37:04,743073,Worry,Sense cost not write.
a0cc47f5-adc9-4307-8137-360eb9c70604,2025-08-02 02:40:09,834475,Exactly,Chair series peace college level.
2ce6aa1f-25ca-4175-b802-0ad231e6f679,2025-02-08 19:54:38,866645,We,Raise energy stop crime.
de1057c1-f015-4874-ac1c-c4de831852cf,2025-03-08 01:16:34,164440,Information,Health ability job son.
619f88f0-0e13-434d-bdf1-874f524b5609,2025-05-13 03:56:16,926768,Way,Bed foot here throw low minute draw.
fc754657-7b91-42c7-a7e4-9647eabf9549,2025-07-27 18:26:21,303095,Real,Company read direction political family medical yeah manage.
3f897897-cbd7-46d1-ab05-318e0dd9366c,2025-04-15 23:53:46,189876,Plan,Case both citizen personal.
5da426e9-386e-44db-a88a-a6d4fd2ac12b,2025-06-03 18:54:52,580022,Teacher,Catch down try no church compare for.
d7c2a59c-50de-40f6-8d9b-ce5519647a70,2025-02-01 13:04:24,246933,We,In glass act case Mr.
7ccf5391-9927-48be-927c-7cd1da56de95,2025-03-22 21:12:00,936297,Several,Hospital development buy human clearly hundred.
ff1c587a-15b2-4fe9-87ab-3090fb0fb7c2,2025-06-14 06:36:24,108700,Reach,Win quite finally throw.
9b0935f0-1002-4d9f-a982-9fdee91ddb7f,2025-03-31 13:08:28,702890,Fear,Former standard new recent.
a7cfe38a-5770-4fb7-9cc2-8dc56f4150c3,2025-02-14 21:35:54,780056,She,Medical meeting smile individual executive edge.
204e4730-a893-4c33-bc85-aa714fbad26a,2025-07-29 13:08:06,738886,Give,Much member art fly produce.
529b9c10-070a-4b18-beb2-ad5059e7b6ca,2025-05-07 08:23:16,734948,Improve,One become loss travel.
efac9176-ec41-4872-bb89-fec60d8cbd22,2025-04-27 07:59:55,467666,Surface,Anyone remember sister teacher forget.
caaaf813-09d5-45a4-a560-16ee91367614,2025-08-02 10:56:49,304186,Actually,Part fly difference next our describe.
febd2231-c55c-41bc-b643-9a2af010f561,2025-03-18 03:50:51,297320,Pm,Year across affect go.
91bbe95e-3b2c-4f64-8bb1-cedd226cbf45,2025-03-21 12:33:38,289916,Hand,Stand major education miss whom.
674ebf99-f716-4f4b-8ccd-b90ec6e0c419,2025-04-15 06:17:24,990087,Analysis,If these attorney ever attack all case role.
f3ba66ca-7346-4677-98d8-cd5f4ca22871,2025-05-17 09:13:46,208268,Nothing,Position activity stop.
f4c5337b-9a75-43b0-ab2f-210217d263b4,2025-06-11 15:40:58,787570,Say,Floor us seem even move may alone.
8f89132e-e5b5-46ac-932c-75a61e938f99,2025-02-27 18:28:16,466606,Bag,Shoulder nearly meeting describe.
dc149b8e-f397-4b2b-b7d2-d295be27a34b,2025-07-19 04:30:04,875395,Possible,Off realize off staff magazine heart.
28de1526-3df2-43d7-822f-a1d73fa06f8d,2025-02-17 07:39:12,169649,Break,Talk improve heavy today moment control business.
0d2fa8a2-2f4a-4376-8cc7-bcc31090e961,2025-06-02 04:00:08,415848,Standard,Somebody owner yard budget add source.
dfe97e58-14c2-4ef0-8aeb-2cc4fa2ed864,2025-02-04 12:06:30,128388,Best,Outside establish explain well.
1b05db75-d94a-4b90-aed8-b9978040f89d,2025-02-08 04:54:51,407234,Sea,Possible quickly film other shake.
fdc2d13c-9cc3-40be-95ad-12beea32cedf,2025-05-22 03:23:57,469224,Floor,Enjoy store rise far they success.
1e32ca34-3323-489b-a05e-97d2a7541545,2025-01-29 20:51:46,685503,Dinner,Two show culture home paper.
599db245-cc49-44d4-8483-dfa8f461ef86,2025-04-04 04:20:52,305912,Stop,Dark authority small myself time according development.
a2d7233e-0237-4651-8dee-f0c6f4f1d829,2025-03-02 20:30:24,879697,Out,Always during offer half.
0313f73d-87d9-45a0-bb8c-da19c543c7a8,2025-05-06 23:25:26,783590,Once,Change manage imagine piece dinner behavior politics bit.
0dde1605-880f-4e17-b98b-6a69071682e7,2025-08-08 17:09:51,268343,Focus,Most type quite business let say.
365f708e-a574-4d52-9821-988c2b255410,2025-07-19 14:14:47,470692,Mother,Compare drug safe at thought necessary them.
a864967d-83d4-4434-b1bd-8699d2ed4c9f,2025-05-03 07:13:34,447516,Impact,Charge effort during paper dog fine level.
3940c90c-4dde-4f22-b3a5-5b9e8d3a2df2,2025-06-13 17:43:05,363694,Here,Because commercial relate.
fc4565a3-95d1-4a9a-bd9d-24af3341dadf,2025-01-19 03:38:38,201842,Contain,Example theory store technology simply financial any.
7088b29f-e431-4ae2-8324-8980ad0e7955,2025-05-02 20:10:01,450147,Science,Concern seek speak remain.
bc76b23b-72ec-48a8-af23-cf5eff26303c,2025-04-26 16:19:43,283049,Note,Thank find ago computer.
6b758097-5683-4b74-9842-c7d544842d11,2025-06-17 17:31:02,782580,Feeling,Traditional five realize poor environment.
fb4118eb-6165-4508-aacb-62493e11bcce,2025-02-14 04:14:30,179606,Everybody,Rich resource statement.
aec2f240-4716-4d46-a708-6c6437b801ef,2025-02-25 16:07:05,254079,Agency,House model share then.
874e4e2d-4d29-4de1-8fe8-dfa64c3e0e8d,2025-03-12 22:02:49,118978,Dream,Single church industry network.
dfc0951d-e99a-433e-a9eb-64e993095e8f,2025-01-18 16:21:42,234027,Already,Talk plan couple sea.
a4846db7-4c0d-4062-ad73-92e2db63ae19,2025-05-15 01:25:49,252170,Great,Responsibility available improve suggest any spring.
b3b50b5e-8a78-42ad-b746-c9c52a1fbfd5,2025-06-15 19:54:06,253880,Leader,Evidence since today provide four deep wrong camera.
12f4b5f4-6b2d-451e-bb36-1432146ab676,2025-04-15 19:39:48,899837,Piece,Relationship probably alone because.
8348ca62-6934-4b14-8bc1-e7eaa55af160,2025-01-24 14:30:48,452869,Which,Wide people great positive support matter senior.
010958dc-681c-4c2a-a24e-d7c06756b45c,2025-05-06 08:54:23,479416,Thing,Back possible but tend worry raise body.
e1906ed1-3df9-4156-81a4-3b9af06f3fb1,2025-04-25 18:50:41,860847,Since,Low nearly smile factor common speech line among.
7252053a-4a80-4689-be6f-63983a4e59d3,2025-05-24 01:27:10,578279,Realize,Reveal fast just there.
7690b30a-edf3-4913-9bdc-f897160c09ff,2025-05-13 15:38:21,630640,Never,Dark wait push wind agency help if former.
e4ec4eb6-09b3-4bca-9f30-cd8cbd7adf31,2025-01-10 17:46:43,951672,Its,Word use agreement girl total seat.
4692da36-fd6f-4305-8036-de1895c51090,2025-02-09 18:43:02,383612,Choose,Interview account pay glass own.
976aa593-9f9c-448f-be0c-1cfc59cf602d,2025-04-11 09:22:58,496384,Walk,Often significant consider consumer tax pass evening.
04a706ee-77f6-4df4-aeb2-fe4547bb9f16,2025-02-09 08:04:09,459404,Available,Say nice although him buy view interview raise.
df59e504-e77e-4de9-af31-73c4e16a4488,2025-07-14 23:42:46,884605,Wind,Left main local world bed anyone owner.
4e81b743-8e74-45d0-8298-373ee8d53164,2025-03-28 00:47:25,167380,Ten,Together return fact sister.
65596f9c-af3a-4d8c-aa33-af4c778cfeba,2025-05-06 07:20:14,526887,How,Hair high of seem whether week.
408d0217-ce9b-4c3d-a96b-fdb3de6955b5,2025-06-21 08:38:10,905386,Step,Anyone surface ball common their.
5d665158-e1bd-4979-9c33-8a9fbbdc3639,2025-06-18 00:46:03,265175,Understand,Dream song card about.
cbcd4b58-594e-4bef-9478-8da45fdb49b3,2025-04-19 16:49:22,245690,Seat,Matter training member.
5871b116-f4b0-4e7b-b2a9-c4a73cbf8def,2025-02-18 13:44:20,445569,Much,Three seek range system attorney listen.
b9a2156b-ae1b-4f3b-bd7c-73f025446de6,2025-07-15 18:34:31,979589,Explain,Identify likely short yes.
40c95fc5-5fa0-4922-b624-c3b7046e7d2d,2025-06-25 15:02:01,703360,Player,Mission side court.
47aa885b-4793-47d9-9b79-cbcdd7934492,2025-05-23 00:44:43,992471,Treatment,Consumer receive but very small star language coach.
e4ee8234-079c-4489-a6c9-c83c2ce841f5,2025-04-16 04:36:06,985313,Law,Past about resource town education matter clearly.
512c61b8-f0d7-414f-9366-b34ea742e99c,2025-05-19 17:59:58,839964,Know,Surface police item girl offer wonder create.
4404e114-07bd-4a6c-80a1-9118afc49c42,2025-01-22 08:34:08,871261,Small,Age successful unit decade keep miss.
0335f46b-61b1-41c9-bf20-f6e9255d14c1,2025-03-24 14:15:08,151795,Everything,Method ability win too.
ed0d14c6-3877-427b-870e-b50d4319f909,2025-06-23 01:42:52,685279,North,Answer customer most authority quite let force.
06dad626-0e1d-47c0-a0e5-a061741ff869,2025-02-14 08:27:13,506170,Commercial,Month probably or dream compare attack.
76ee2e5b-e21f-45a3-bd96-9fccdc37316e,2025-06-07 09:17:19,299592,Decision,Wish guess always education series window fact.
19521828-54bb-4e69-b1cf-fca91fddd194,2025-03-24 19:52:27,593819,Deal,Final degree own maybe reflect.
b88a921f-563c-455c-982e-7a197ae24586,2025-06-21 05:21:21,962713,Vote,Former shoulder wind wrong box already strategy foreign.
22be403b-5e05-4953-955d-e53a2559d0e2,2025-02-17 22:14:30,410380,Actually,Professional money the organization.
8a0cb36f-27c6-4fc3-9874-8dbdc380a61d,2025-02-20 00:25:22,904144,Be,Beautiful wish man head fly realize million.
ff104258-a1bd-475b-aad6-a65832608099,2025-05-25 18:23:53,556495,Else,Current nation wrong shoulder.
