id,createdAt,hs_object_id,name,description
bd379b99-a51c-40d8-a4fe-765b2f591b89,2025-04-07 19:42:15,865708,Company,Often hotel great discussion music civil.
c2066e74-eb4f-44e3-9211-ef1eec7fbe1a,2025-06-12 15:16:43,342712,Scientist,During listen raise rich start avoid above.
6fd957d0-18c8-4d76-b66c-864925166448,2025-07-01 14:15:44,868290,Case,Eat rock war.
8dcb9725-df80-43c4-b982-687bda7ee577,2025-05-06 16:46:00,649185,Member,Daughter and chair.
dc2543ef-cff5-40f1-9113-7b68343017db,2025-05-29 03:34:39,801506,Painting,Trade approach poor director.
e7e349dd-4703-4d44-bd10-41ffffa5cd06,2025-06-26 20:19:47,918828,Last,Some pretty push particularly pressure hour.
43ccd268-45f5-41fb-81f2-a0acf6ae5213,2025-08-05 17:00:27,922324,Program,Each table century week bit every.
a11c85b7-db68-48d1-915b-44bb665172dd,2025-07-17 16:08:26,448996,Mr,Together organization prevent choice Mrs.
d17a85cd-c546-4581-af8b-03e32a622343,2025-04-11 19:19:16,341014,Attention,Discover hour source cover machine.
36f42c4d-bb8b-43fc-8e80-823c5c4dab4d,2025-04-23 11:34:51,713444,Word,Certain song Democrat meeting read.
0abad203-488b-4f0a-a906-d654f4b98402,2025-01-27 21:38:08,672462,Realize,Miss play main detail color special.
0470deec-20cb-4b7d-b1b8-29a3ebefcb68,2025-01-21 22:36:48,131629,Interest,Much girl who friend back perform call big.
a1b1911f-b55c-4e35-8bfb-25d4da901f14,2025-04-23 09:59:35,359653,Republican,Idea law fill hope determine term her.
0f2e8a4c-81ce-4a13-b8e8-29f47522fce6,2025-02-18 21:20:59,552475,Big,Agree call bank fill direction question body.
19bb6d9a-0d6e-47b2-922c-5121931e0124,2025-02-22 13:01:59,441346,Lead,Day drive allow then than car spring heavy.
acb1bbe8-ff32-47e1-871a-e5ca5210d342,2025-02-23 21:59:58,715232,Pay,Those where experience avoid road account box.
4bf415ab-31c2-4f39-bed6-06428d06f084,2025-06-21 16:17:25,719085,Note,Garden high else prove particular material.
86d9b68c-b802-40a3-8235-a2c797ecac01,2025-05-16 01:33:47,164589,Why,Structure media remember practice example.
44724ca1-83f5-4937-8d88-61d70cbbed79,2025-02-11 23:08:58,291082,Door,Region heart so environment.
3afef857-6afa-4638-ac51-0c9b6f1b6971,2025-05-07 12:51:24,262171,Food,Cultural price behind Republican ten.
99a718f1-5891-4347-9c7f-f3892b6c1650,2025-05-27 01:53:39,180184,Campaign,Kitchen agreement among play scene respond economy run.
d945423a-08d3-4cb2-9e88-ff5e9a5e1b1d,2025-07-25 01:50:57,448333,Turn,Small assume article.
c9dc6661-afd8-4722-b2de-d17cda17261f,2025-04-26 06:27:41,463348,Another,Choice treatment west.
13d54dda-69aa-45d7-8d46-4fb841a296a8,2025-04-30 07:32:33,307966,Leave,Republican war score bit.
6946fc21-9ae3-4696-87a3-13b458ba22b7,2025-01-15 00:17:48,713001,Radio,Population probably however next against simply early song.
2b92a04c-1c10-4595-a79a-e0cfad84588f,2025-01-17 02:16:20,866409,Type,Career media involve nice.
fe4c0db0-10b7-4d91-add0-4f7018da287b,2025-07-28 04:54:28,313922,Happy,Glass line top body while organization.
eb89b6c1-0bdf-4ea1-b8ef-7e3622709724,2025-05-11 04:30:02,157481,Word,Buy view must three thing.
19bfbe3b-c785-4451-9e07-5bf110c363a7,2025-07-01 18:54:12,497650,Big,High bank continue opportunity social choose find.
6b40c93d-7062-44b7-a6be-ccb5b335ec0d,2025-03-28 20:36:00,686276,Commercial,Bill view can team wide star should board.
f39ee82c-a639-4ff0-8e62-1c68690ef1fe,2025-05-05 19:58:21,652091,Story,Drop hair bank card democratic explain center.
2c1af003-a5b3-4e62-8bf7-c609efb26a87,2025-02-05 05:31:07,810015,Indicate,Still run low administration lawyer decision less phone.
ae19ac08-b660-4049-b63e-61040838721d,2025-04-23 03:28:04,305993,Show,Environment mother those.
94c34d33-99c3-45c0-af0f-01e68e84f6ee,2025-06-15 19:18:25,612177,Care,Key street personal nothing.
acc9c704-8105-465e-b65b-2d7eff986aa2,2025-07-27 21:21:43,540355,Establish,Rather but threat stage future feeling.
c7c8ab19-dcf0-453b-813e-005bb79f4a22,2025-03-29 06:32:45,333829,Once,Study loss occur consumer term financial.
d4537d19-8bf8-465d-a5a0-319117516543,2025-05-21 03:11:36,436175,Bed,Her value it probably score.
7e20d0bb-a4af-4b4e-98be-d600fcc20c1a,2025-08-05 04:03:56,272045,Improve,Better ability area early song attention church management.
39092626-0b49-4a54-a430-4d1ec908d122,2025-02-06 08:52:24,149797,Method,White adult develop piece water wait.
3240a00d-e35b-4bb5-b3d0-d52334fa0432,2025-04-09 19:51:18,964331,Economy,Research point analysis turn rest amount.
b99f966a-a3d8-4c59-9089-215e82e63e5a,2025-03-22 07:36:14,512624,Game,Serious likely reduce compare religious.
b4b25283-5e51-41cb-8ed7-a7f40bde379b,2025-07-30 01:07:19,896392,Resource,Idea speak risk end.
73d3f3fa-be20-4049-9736-c2962af157e8,2025-05-20 07:37:31,494113,Individual,Machine would response relationship start deep.
3a12f27e-66bb-42e5-bd2a-18a91b236238,2025-02-19 12:04:05,728520,Shoulder,Trial mean under east step operation.
e0c674fe-85be-4681-9682-277a0bf5b168,2025-02-06 21:39:50,161698,Front,Major message value score who knowledge.
9a956c53-a510-473d-95ef-c11301ab6108,2025-06-11 05:23:08,858905,Say,Direction along far simple community might.
235f938f-50c4-4a32-b3c5-d82a12854b6b,2025-05-26 01:32:51,490896,Total,Statement girl response treat would night cause.
71ceb55a-f916-4f41-a024-5e97fdb098c7,2025-03-19 09:05:35,553115,Whose,Teacher generation apply.
07308249-b98b-4666-bacd-a6eeb19ed557,2025-04-26 08:37:21,551964,Often,Politics son increase role should begin learn reveal.
89c80a6a-079c-4ed6-96a6-f253cd518886,2025-03-19 11:05:42,442594,Together,Minute about important.
72577a46-8681-4f2f-85d9-ca8923d72f8f,2025-02-27 19:22:41,217189,Near,Item item still future.
c72efada-13a2-4efe-b77d-4dba9f9ef3df,2025-02-12 06:00:04,271025,Argue,Alone environmental anything down show class capital authority.
04ed6b4a-dc84-47ec-8d6a-d50a12ea3a81,2025-01-08 12:48:16,819702,Term,Future year among hair down.
7291bb31-e511-4cff-b340-fe927c8f2cfa,2025-08-01 03:41:58,339686,Doctor,Suddenly sell building leave rate.
26eae1d7-03bc-4081-a45a-12a2f0e406db,2025-02-06 04:29:11,481502,Have,Support lawyer painting play.
49ddb8dc-6b95-4005-92e1-8d93deda4048,2025-01-10 07:15:01,485907,Stock,Air purpose maintain future weight once hold.
fb4f5b1f-cf0a-4bee-bc5b-fb63c2ca0e5e,2025-02-17 12:03:32,825579,Treat,Free speak your follow avoid option spend firm.
b56baa3c-d2a5-4ea3-9035-f975fe4e34bf,2025-04-30 19:26:54,662758,Establish,Choice college election pattern Republican.
b1757b24-5234-41e8-be12-fa8d604fec8a,2025-04-19 07:12:06,389234,Sport,Order act himself gas sound.
59d39b7b-e11b-48aa-95e8-9bf11402ecc2,2025-04-13 21:09:26,526161,Many,Adult letter research learn race ten.
dbcead74-6b13-43f0-bc57-7d983681dc92,2025-06-27 00:52:41,425228,Area,Sometimes black effort truth.
d80bf18a-3b2a-4933-93f6-e2db7f30b7c1,2025-04-05 01:02:37,820368,Yet,View four suddenly.
d4b83151-8b34-4f82-875e-41a028b5fa26,2025-04-08 11:07:13,313167,Letter,Commercial teacher him themselves Mrs range.
0e0a8a99-aa33-4bb5-ab59-a79af991ed21,2025-02-02 20:05:52,207876,Computer,So ever off remain.
be52ce0b-98a7-4220-8621-16eada1ec784,2025-05-17 20:29:29,659133,Wrong,Bring most fall child perform.
5d9a91b6-d57f-4475-948b-64e003a2cbbc,2025-03-27 10:01:59,298423,Recent,Interesting television church pass government sea.
6cc0911a-da7d-4b0f-b457-6ca7eb89830d,2025-01-15 19:37:27,635213,Science,Push feel evidence always present military.
245f1d0f-1a0a-42e4-a7a4-1c3cb7250a57,2025-05-24 22:06:56,732264,Relationship,Single popular large focus.
c795a4a2-c3ed-445b-8e5f-1da6abd2e8a7,2025-07-05 16:48:42,337474,Five,Bit both traditional.
1aa7824d-76e4-4b0d-a9ff-2724475853b3,2025-03-04 17:39:35,865276,Per,Movie analysis now attorney week with.
eae37824-5bda-46bb-9a63-82fe34fe6af6,2025-04-11 19:00:13,758433,Low,Drop go strong week section door look.
c1d00ed4-a9b7-472c-b2d7-766629890b49,2025-06-17 19:57:34,544517,After,Whole heavy level.
ffd21b97-52d2-446a-aa91-b7ebaf4695d8,2025-05-12 01:14:07,442344,Capital,Walk common small design buy.
d28cb6e3-5b5d-4191-bc0c-ecac3956b536,2025-06-11 01:45:40,693691,Skin,Own story situation once whose wind college.
9bd5b6d9-3f70-49ab-ac7b-d9b2a825e0a8,2025-05-25 15:35:27,872839,Society,Question suffer human personal central.
5be1cd6f-6b8e-4499-a53d-8ffcb305d9cf,2025-05-20 00:07:48,777408,Buy,Might nor most left prevent.
97fdc15d-790d-474e-83a3-76ef52cfeca1,2025-03-21 08:16:43,981162,Future,Just poor each throw great shake rock.
afa8a1b4-8661-4901-bbb5-1a12ad27a582,2025-06-01 00:48:17,986573,Group,Step ball most TV window affect.
7cde4537-8d70-4261-b987-a78443394556,2025-06-18 15:07:59,581218,Crime,Threat once table talk whose.
46531640-bd7f-434d-8c0a-eeca0b6b91d5,2025-03-08 12:08:53,217540,Under,None floor fall down leg be.
9b18f095-addc-4cf6-9844-faa6df98ff86,2025-01-31 10:45:44,320659,Husband,Add test rise deal pretty space.
c1294f3a-d771-4ad3-bbc2-4b94136db819,2025-02-02 17:58:16,253966,During,Happy after computer such provide couple what turn.
84618185-314b-4b27-ac02-15bbf87e0130,2025-02-27 04:19:52,660410,Door,May coach service join health old.
dcf705c3-dce8-4a93-84e7-cb32ff783221,2025-06-27 07:20:31,655790,Choose,As space answer college.
4561fbf0-964c-4269-b222-2193a64b4eaa,2025-05-01 17:25:48,836451,Main,Then stock face pass site wall.
d2956ac4-eba1-4237-9a43-1a046a020747,2025-02-26 11:41:12,736649,Mean,Television well staff me.
34ebc643-8b91-4929-9702-53840506c88a,2025-07-22 13:43:20,978894,History,Open expert point.
a52c4d58-e6d5-47e7-baac-527f37ea3ca8,2025-06-24 19:13:23,518762,Vote,Fact about rich operation early.
29321ac1-e6d0-44e6-9f61-5497a7a4e5c5,2025-04-14 03:33:05,791122,Prevent,Wall partner machine son seat.
aae5c216-2765-4b40-9ed1-61de5d45f10e,2025-07-08 22:22:11,953641,Hope,Rest make modern commercial level.
ffb9da21-b0be-477c-9dcc-3d4951e6df71,2025-06-25 13:30:29,926660,Wait,Production believe class news usually common material lot.
c1f658c0-c6d5-43a0-bd60-22a522cb0971,2025-02-03 11:08:18,876975,Myself,Himself politics move thousand arm.
6da13065-57f0-41f5-91bb-b456dfe3fb9c,2025-06-07 01:09:41,565055,Specific,Word impact building total bill.
d79ca75f-e25c-4761-bec0-c806aec09890,2025-05-27 02:20:33,583127,Everything,Meeting middle chance though nearly.
b01e3c26-0e55-47a8-9883-362ee7234fc4,2025-05-24 18:17:00,568528,Result,Beyond evening community daughter start age the nor.
6ca91f3f-3c93-4cc0-8f9c-cebc7bdf2dce,2025-02-16 16:51:04,659230,Sign,Front into commercial simple themselves task meeting.
c281ce10-19a6-4b45-b2a7-063a885b8092,2025-03-27 04:50:04,221376,New,Very animal sound road.
c06ce89f-2496-4774-9d28-9354f7ea6a16,2025-02-03 11:01:36,159277,Action,Former feeling debate way response point.
080827c7-ba94-4664-8b08-a1655503044a,2025-05-31 05:51:35,828845,Space,The teach year star deep.
82916ebd-47b6-4a73-bbe1-4e9d2c8fc56c,2025-02-01 17:09:42,729787,Candidate,Water attention become tend skill anyone.
